{
  "$schema": "./master-catalog.schema.json",
  "schemaVersion": 1,
  "revision": 17,
  "updatedAt": "2026-09-14T20:19:38Z",
  "show": {
    "names": {
      "full": "DR M Experienced, with Dr. David Musnick MD",
      "short": "DR M Experienced",
      "host": "Dr. David Musnick MD",
      "hostLine": "with Dr. David Musnick MD"
    },
    "profileCopy": {
      "short": "DR M Experienced, with Dr. David Musnick MD. Practical insights from decades in sports, regenerative, internal, and functional medicine.",
      "long": "DR M Experienced, with Dr. David Musnick MD. Practical insights from decades in sports, regenerative, internal, and functional medicine. Dr. Musnick is board-certified in Internal Medicine and Sports Medicine and brings more than 35 years of patient-care experience to focused conversations about brain health, concussion, sleep, fatigue, inflammation, recovery, and whole-person medicine. Episodes are educational and are not a substitute for individualized medical advice, diagnosis, or treatment."
    },
    "canonicalPodcastFeed": {
      "provider": "rss_com",
      "url": "https://media.rss.com/dr-m-experienced/feed.xml"
    },
    "artworkRefs": {
      "logoHorizontal": "show-logo-horizontal",
      "logoStacked": "show-logo-stacked",
      "logoMark": "show-logo-mark",
      "avatar": "show-avatar",
      "podcastCover": "show-podcast-cover",
      "youtubeBanner": "show-youtube-banner",
      "openGraph": "show-open-graph"
    }
  },
  "assetRegistry": {
    "show-logo-horizontal": {
      "kind": "image",
      "role": "logoHorizontal",
      "uri": "dropbox:brand/masters/logo-horizontal.svg",
      "sha256": "0e2cdac66f4c30240e1fe9d6db0f6ee6f80e4a891c28e746af3c15da3f5d28d9",
      "sizeBytes": 10312,
      "mediaType": "image/svg+xml",
      "status": "verified"
    },
    "show-logo-stacked": {
      "kind": "image",
      "role": "logoStacked",
      "uri": "dropbox:brand/masters/logo-stacked.svg",
      "sha256": "e853d83964198b49c70bad4731cf27fff71748ebf8b4bc763817d6eb56983239",
      "sizeBytes": 10234,
      "mediaType": "image/svg+xml",
      "status": "verified"
    },
    "show-logo-mark": {
      "kind": "image",
      "role": "logoMark",
      "uri": "dropbox:brand/masters/logo-mark.svg",
      "sha256": "162ea4755a17a356c26b1495a04d96ae58a1985aa86a3065cb3164e90a5ea5b4",
      "sizeBytes": 513,
      "mediaType": "image/svg+xml",
      "status": "verified"
    },
    "show-avatar": {
      "kind": "image",
      "role": "avatar",
      "uri": "dropbox:brand/masters/avatar.png",
      "sha256": "13220c2e153700417df901362e5fb9455f88a80effc27fdfcd94b4e557309465",
      "sizeBytes": 66311,
      "mediaType": "image/png",
      "status": "verified"
    },
    "show-podcast-cover": {
      "kind": "image",
      "role": "podcastCover",
      "uri": "dropbox:brand/masters/podcast-cover-3000x3000.jpg",
      "sha256": "fb4a1e2244e7f7d97956043f201d23650e1689f5f30caafdc873207cedcbe596",
      "sizeBytes": 1067196,
      "mediaType": "image/jpeg",
      "status": "verified",
      "publishedUrl": "https://media.rss.com/dr-m-experienced/podcast_cover.jpg"
    },
    "show-youtube-banner": {
      "kind": "image",
      "role": "youtubeBanner",
      "uri": "dropbox:brand/masters/youtube-banner-2560x1440.png",
      "sha256": "1ddbfc6a325b1c6b2eb719c6a4015377cd761b5e8b6501c41e8b15a416507797",
      "sizeBytes": 2854854,
      "mediaType": "image/png",
      "status": "verified"
    },
    "show-open-graph": {
      "kind": "image",
      "role": "openGraph",
      "uri": "dropbox:brand/masters/open-graph-1200x630.jpg",
      "sha256": "a2494395a02c7682a3214baee87755dedbad4f03d95253c69c7fedf44b576e98",
      "sizeBytes": 189768,
      "mediaType": "image/jpeg",
      "status": "verified"
    },
    "episode-001-master-video": {
      "kind": "video",
      "role": "fullVideo",
      "uri": "dropbox:episodes/001-brain-fog-part-1/master-video.mp4",
      "sha256": "bc873595eb688c19a1684af6d4bfac720a9afb2d4c4b017ecc299e4e673716d5",
      "sizeBytes": 936971338,
      "mediaType": "video/mp4",
      "status": "verified"
    },
    "episode-001-podcast-audio": {
      "kind": "audio",
      "role": "podcastAudio",
      "uri": "dropbox:episodes/001-brain-fog-part-1/podcast-audio.mp3",
      "sha256": "4d7821bbd98fb7830100f8af415a17f68b803043c1b6bb09429f51b56c746d5a",
      "sizeBytes": 24509421,
      "mediaType": "audio/mpeg",
      "status": "verified",
      "publishedUrl": "https://content.rss.com/episodes/397420/3050766/dr-m-experienced/2026_08_07_05_37_14_57d1a0c9-5f80-4880-bc5d-57f7eeef7cb5.mp3"
    },
    "episode-001-thumbnail": {
      "kind": "image",
      "role": "thumbnail",
      "uri": "dropbox:episodes/001-brain-fog-part-1/artwork/video-thumbnail-1920x1080.jpg",
      "sha256": "b091d52d514dc00725e52d3760117b431e063ed1220c2b328613a200caa88416",
      "sizeBytes": 227511,
      "mediaType": "image/jpeg",
      "status": "verified",
      "publishedUrl": "https://drmexperienced.com/images/episodes/brain-fog-part-1.webp"
    },
    "episode-002-master-video": {
      "kind": "video",
      "role": "fullVideo",
      "uri": "dropbox:episodes/002-brain-fog-part-2/master-video.mp4",
      "sha256": "935ceca9290699c70fe1fc07a2d430113f8a703f2d674742ffd66c412593bb0f",
      "sizeBytes": 1086944676,
      "mediaType": "video/mp4",
      "status": "verified"
    },
    "episode-002-podcast-audio": {
      "kind": "audio",
      "role": "podcastAudio",
      "uri": "dropbox:episodes/002-brain-fog-part-2/podcast-audio.mp3",
      "sha256": "406373597936f206a7b788647fa6ac39301c3e25d9b30d8db7fde571ea80450f",
      "sizeBytes": 28828845,
      "mediaType": "audio/mpeg",
      "status": "verified",
      "publishedUrl": "https://content.rss.com/episodes/397420/3050765/dr-m-experienced/2026_08_07_05_41_20_c5dc584a-9799-404f-96e5-66fd2958ad94.mp3"
    },
    "episode-002-thumbnail": {
      "kind": "image",
      "role": "thumbnail",
      "uri": "dropbox:episodes/002-brain-fog-part-2/artwork/video-thumbnail-1920x1080.jpg",
      "sha256": "04f743a5d2f06028a31407e62f5da2c21f450ce4c4ee2165c1a6ef94f24a1677",
      "sizeBytes": 252981,
      "mediaType": "image/jpeg",
      "status": "verified",
      "publishedUrl": "https://drmexperienced.com/images/episodes/brain-fog-part-2.webp"
    },
    "episode-003-master-video": {
      "kind": "video",
      "role": "fullVideo",
      "uri": "dropbox:episodes/003-episode-3-insomnia/master-video.mp4",
      "sha256": "538b7a80a60268dbe87bff468e144ee8458c244309f6607b00548098ca0a2ca4",
      "sizeBytes": 1382150506,
      "mediaType": "video/mp4",
      "status": "verified"
    },
    "episode-003-podcast-audio": {
      "kind": "audio",
      "role": "podcastAudio",
      "uri": "dropbox:episodes/003-episode-3-insomnia/podcast-audio.mp3",
      "sha256": "3804409eb2f96e52eba661d678c88a30ee9c4cbc0ea0709524fbdbdaa94cbe4e",
      "sizeBytes": 28779309,
      "mediaType": "audio/mpeg",
      "status": "verified",
      "publishedUrl": "https://content.rss.com/episodes/397420/3050764/dr-m-experienced/2026_08_07_05_42_30_c6bd9b48-095f-4ee9-9eda-ebb0d7956d09.mp3"
    },
    "episode-003-thumbnail": {
      "kind": "image",
      "role": "thumbnail",
      "uri": "dropbox:episodes/003-episode-3-insomnia/artwork/video-thumbnail-1920x1080.jpg",
      "sha256": "6e09d43daf671d65d81f8fd403f9c693d073c4edaf99c759f01e46da27d2de4b",
      "sizeBytes": 155490,
      "mediaType": "image/jpeg",
      "status": "verified",
      "publishedUrl": "https://drmexperienced.com/images/episodes/insomnia.webp"
    },
    "episode-004-master-video": {
      "kind": "video",
      "role": "fullVideo",
      "uri": "dropbox:episodes/004-episode-4-emf/master-video.mp4",
      "sha256": "129bf322ed83c38ae586bd83d6124dac64bc9864056e6e4ff72034b5e85780ca",
      "sizeBytes": 1189902893,
      "mediaType": "video/mp4",
      "status": "verified"
    },
    "episode-004-podcast-audio": {
      "kind": "audio",
      "role": "podcastAudio",
      "uri": "dropbox:episodes/004-episode-4-emf/podcast-audio.mp3",
      "sha256": "c3e2ea0f8ee52401d3e98580465b10294170d50ce4db59ea89a00db46f37f460",
      "sizeBytes": 28313325,
      "mediaType": "audio/mpeg",
      "status": "verified",
      "publishedUrl": "https://content.rss.com/episodes/397420/3050763/dr-m-experienced/2026_08_07_05_43_51_32e2ccc6-04c8-4592-9e50-aa8d48eb9cb8.mp3"
    },
    "episode-004-thumbnail": {
      "kind": "image",
      "role": "thumbnail",
      "uri": "dropbox:episodes/004-episode-4-emf/artwork/video-thumbnail-1920x1080.jpg",
      "sha256": "af56bcf291e595d9b80ce262b2f9d9199d7ce01ceba44829371163cb3b88721d",
      "sizeBytes": 110860,
      "mediaType": "image/jpeg",
      "status": "verified",
      "publishedUrl": "https://drmexperienced.com/images/episodes/emf.webp"
    },
    "episode-005-master-video": {
      "kind": "video",
      "role": "fullVideo",
      "uri": "dropbox:episodes/005-episode-5-energy/master-video.mp4",
      "sha256": "ef25952275c22633e6deb3e1dfd142ed4890ce688301aaba8bef78f04d9f9b58",
      "sizeBytes": 8743493742,
      "mediaType": "video/mp4",
      "status": "verified"
    },
    "episode-005-podcast-audio": {
      "kind": "audio",
      "role": "podcastAudio",
      "uri": "dropbox:episodes/005-episode-5-energy/podcast-audio.mp3",
      "sha256": "3acf88aa7cb25041dbe34eee3242b3f57d9e62cbc42d54624467dc609ef4a7c0",
      "sizeBytes": 42857901,
      "mediaType": "audio/mpeg",
      "status": "verified",
      "publishedUrl": "https://content.rss.com/episodes/397420/3050762/dr-m-experienced/2026_08_22_21_31_50_62730fc1-465f-4df9-9c8a-d721be928586.mp3"
    },
    "episode-005-thumbnail": {
      "kind": "image",
      "role": "thumbnail",
      "uri": "dropbox:episodes/005-episode-5-energy/artwork/video-thumbnail-1920x1080.jpg",
      "sha256": "0efbc07a236a563590381682f21439bfb310444418793a3ff4d51522da46cb6f",
      "sizeBytes": 235198,
      "mediaType": "image/jpeg",